{
  "caseVersion": "restaurant-fixed-workers-case/v2",
  "caseId": "dinner-rush-v2-dev-2",
  "benchmarkVersion": "restaurant-fixed-workers/v2",
  "graderVersion": "restaurant-fixed-workers-grader/v2",
  "split": "development",
  "level": "dinner-rush-v2",
  "seed": 2,
  "durationTicks": 120,
  "arrivalTicks": [3, 9, 15, 21, 27, 33, 39, 45, 51, 57, 63, 69, 75, 81, 87, 93, 99, 105],
  "cashTarget": 190,
  "eventSchedule": [
    {"tick": 8, "kind": "oven_failure", "targetId": "oven-1"},
    {"tick": 75, "kind": "warming_shelf_overheat", "targetId": "warming-shelf-1"}
  ],
  "thresholds": {
    "resourceFloor": 0,
    "resourceCeiling": 190,
    "recoveryTarget": 4,
    "recoveryHardDeadline": 8,
    "service": 80,
    "resources": 80,
    "recovery": 80,
    "safety": 100
  }
}
